{
  "eventId": "90000018-0000-4000-8000-000000000001",
  "eventType": "CustomerRegistered",
  "eventVersion": 1,
  "occurredAt": "2026-09-27T10:00:00Z",
  "aggregateId": "11111111-1111-4111-8111-111111111111",
  "aggregateVersion": 1,
  "correlationId": "ejemplo-contrato",
  "producer": "customer-service",
  "data": {
    "customerId": "11111111-1111-4111-8111-111111111111",
    "documentType": "DNI",
    "documentNumber": "70000001",
    "names": "Ana",
    "surnames": "Torres",
    "fullName": "Ana Torres",
    "email": "ana@backendseguros.local",
    "phone": "921175206",
    "active": true,
    "birthDate": "1990-01-15"
  }
}
